[
 {
  "id": "st-s2-5-douleur-thoracique",
  "ssp": "S2.5",
  "titre": "Douleur thoracique aiguë aux urgences, avec une infirmière",
  "format": "urgence",
  "duree_min": 13,
  "competences": [
   "anamnese",
   "examen",
   "management",
   "communication",
   "interprofessionnel"
  ],
  "consigne": {
   "lieu": "Service des urgences d’un hôpital régional.",
   "porte": "Monsieur Marc Favre, 58 ans, arrive à pied avec son épouse pour une douleur dans la poitrine qui dure depuis environ 40 minutes. L’infirmière, Madame Rossier, l’a installé sur un brancard ; elle enregistre un ECG, pose une voie veineuse et prélève le sang sur votre demande.",
   "taches": [
    "Vous évaluez la situation de façon systématique et vous faites une anamnèse ciblée.",
    "Vous faites un examen clinique ciblé.",
    "Vous prescrivez les examens et les premières mesures en collaboration avec l’infirmière, et vous interprétez les résultats que l’examinateur vous remet.",
    "Vous expliquez au patient le diagnostic de travail et la suite de la prise en charge."
   ]
  },
  "ps": {
   "role": "Patient standardisé, avec une infirmière jouée par un second acteur.",
   "identite": "Marc Favre, 58 ans, comptable, marié, deux enfants adultes.",
   "apparence": "Le patient est pâle et en sueur ; il garde la main à plat sur le sternum et parle par phrases courtes, car il a peur.",
   "ouverture": "« Docteur, j’ai comme un poids énorme au milieu de la poitrine depuis presque une heure. »",
   "recit": "La douleur a commencé il y a environ 40 minutes, au repos, devant la télévision. Elle serre derrière le sternum, elle ne varie ni avec la respiration ni avec la position, et le patient la cote à 7 sur 10.",
   "reponses": [
    {
     "q": "La douleur irradie-t-elle ?",
     "r": "Elle descend dans le bras gauche et monte dans la mâchoire.",
     "si_demande": true
    },
    {
     "q": "Avez-vous d’autres symptômes ?",
     "r": "Il transpire beaucoup et il a la nausée ; il respire un peu vite, sans vraie gêne respiratoire.",
     "si_demande": true
    },
    {
     "q": "La douleur déchire-t-elle ou passe-t-elle dans le dos ?",
     "r": "Non, elle serre et reste devant ; elle n’a pas changé de place.",
     "si_demande": true
    },
    {
     "q": "Avez-vous été opéré, immobilisé, ou avez-vous une jambe gonflée ?",
     "r": "Non, rien de tout cela.",
     "si_demande": true
    },
    {
     "q": "Avez-vous déjà eu des douleurs semblables ?",
     "r": "Depuis deux semaines, il sent une oppression dans les escaliers, qui passe en deux à trois minutes au repos ; il n’a consulté personne.",
     "si_demande": true
    },
    {
     "q": "Fumez-vous, avez-vous une maladie connue ?",
     "r": "Il fume un paquet par jour depuis 30 ans et prend un comprimé pour la tension, dont il ne connaît pas le nom.",
     "si_demande": true
    },
    {
     "q": "Y a-t-il des maladies du cœur dans la famille ?",
     "r": "Son père est mort d’un infarctus à 56 ans.",
     "si_demande": true
    },
    {
     "q": "Prenez-vous des anticoagulants, avez-vous des allergies ?",
     "r": "Il ne prend aucun anticoagulant et ne connaît aucune allergie.",
     "si_demande": true
    }
   ],
   "emotions": "Il a très peur de mourir comme son père, et il le dit seulement si le candidat lui demande ce qui l’inquiète.",
   "questions": [
    "« Est-ce que je fais une crise cardiaque ? »",
    "« Est-ce que je vais m’en sortir ? »"
   ],
   "jeu": "La palpation de la paroi thoracique ne reproduit pas la douleur. Le patient reste sur le brancard pendant toute la station."
  },
  "resultats": [
   {
    "moment": "Sur demande, dès la première minute",
    "texte": "Pression artérielle 150/90 mmHg au bras droit et 148/88 mmHg au bras gauche ; fréquence cardiaque 96/min, régulière ; fréquence respiratoire 18/min ; saturation 96 % à l’air ambiant ; température 36,8 °C."
   },
   {
    "moment": "Sur demande d’un ECG",
    "texte": "L’examinateur montre un ECG à 12 dérivations : il montre un sus-décalage du segment ST dans les trois dérivations inférieures, avec un sous-décalage en miroir dans les dérivations latérales hautes."
   },
   {
    "moment": "Sur demande de troponine",
    "texte": "L’examinateur indique que le résultat ne sera pas disponible avant la fin de la station."
   }
  ],
  "grille": {
   "anamnese": [
    {
     "t": "Le candidat précise l’heure de début, le mode d’installation, le siège, le caractère et l’intensité de la douleur.",
     "pts": 2,
     "pourquoi": "L’heure de début compte, car la fibrinolyse ne se discute que dans les 12 heures qui suivent le début des symptômes ; une douleur rétrosternale qui serre au repos oriente vers une ischémie du myocarde.",
     "hyp": [
      "sca"
     ],
     "src": [
      {
       "id": "R-ESC-SCA",
       "loc": "§ 3.2, 3.3.4, 5.1 et 5.2.1, tels que repris dans la chaîne hyp|sca",
       "lu_le": "2026-10-17"
      }
     ]
    },
    {
     "t": "Il recherche les irradiations et les signes d’accompagnement : sueurs, nausées et dyspnée.",
     "pts": 1,
     "pourquoi": "Ces éléments complètent la description de la douleur angineuse et renforcent l’hypothèse d’un syndrome coronarien aigu.",
     "hyp": [
      "sca"
     ],
     "src": [
      {
       "id": "R-ESC-SCA",
       "loc": "§ 3.1 et 3.2",
       "lu_le": "2026-10-17"
      },
      {
       "id": "R-ESC-AORTE",
       "loc": "§ 9.3.1.2 et 9.3.1.3",
       "lu_le": "2026-10-17"
      },
      {
       "id": "R-ESC-EP",
       "loc": "§ 4",
       "lu_le": "2026-10-17"
      },
      {
       "id": "R-ERC-SPEC",
       "loc": "Tension pneumothorax",
       "lu_le": "2026-10-17"
      }
     ]
    },
    {
     "t": "Il recherche activement les signes des autres urgences vitales : douleur déchirante qui migre vers le dos, chirurgie ou immobilisation récente, jambe gonflée, maladie connue de l’aorte.",
     "pts": 2,
     "pourquoi": "Quatre urgences vitales se cachent derrière une douleur thoracique aiguë ; ces questions orientent vers une dissection aortique ou une embolie pulmonaire, qui changent complètement la prise en charge.",
     "hyp": [
      "dissection-aortique",
      "embolie-pulmonaire",
      "pneumothorax-sous-tension"
     ],
     "src": [
      {
       "id": "R-ESC-SCA",
       "loc": "§ 3.1 et 3.2",
       "lu_le": "2026-10-17"
      },
      {
       "id": "R-ESC-AORTE",
       "loc": "§ 9.3.1.2 et 9.3.1.3",
       "lu_le": "2026-10-17"
      },
      {
       "id": "R-ESC-EP",
       "loc": "§ 4",
       "lu_le": "2026-10-17"
      },
      {
       "id": "R-ERC-SPEC",
       "loc": "Tension pneumothorax",
       "lu_le": "2026-10-17"
      }
     ]
    },
    {
     "t": "Il fait préciser l’oppression d’effort des deux dernières semaines, les facteurs de risque cardiovasculaire et l’antécédent familial.",
     "pts": 1,
     "pourquoi": "Une oppression d’effort récente qui s’aggrave et les facteurs de risque augmentent la probabilité d’une origine coronarienne.",
     "statut": "À vérifier"
    },
    {
     "t": "Il demande les traitements en cours, les anticoagulants et les allergies.",
     "pts": 1,
     "pourquoi": "Les antithrombotiques du syndrome coronarien aigu augmentent le risque hémorragique ; leur choix dépend donc des traitements déjà pris.",
     "hyp": [
      "sca"
     ],
     "src": [
      {
       "id": "R-ESC-SCA",
       "loc": "§ 3.2, 3.3.4, 5.1 et 5.2.1, tels que repris dans la chaîne hyp|sca",
       "lu_le": "2026-10-17"
      }
     ]
    }
   ],
   "examen": [
    {
     "t": "Le candidat commence par l’évaluation systématique : impression générale, signes de détresse vitale et constantes.",
     "pts": 2,
     "pourquoi": "La consigne d’une station d’urgence demande de déterminer d’abord, de façon systématique, l’étendue et la gravité de la situation.",
     "ges": [
      "constantes_0",
      "constantes_1",
      "constantes_5",
      "constantes_6",
      "constantes_7"
     ],
     "src": [
      {
       "id": "R-OFSP-INFO-2026",
       "loc": "§ 5.5",
       "lu_le": "2026-10-17"
      }
     ]
    },
    {
     "t": "Il mesure la pression artérielle aux deux bras et compare les pouls.",
     "pts": 2,
     "pourquoi": "Une différence de pression ou un déficit de pouls oriente vers une dissection aortique, qui contre-indique les antithrombotiques.",
     "ges": [
      "constantes_3"
     ],
     "hyp": [
      "dissection-aortique"
     ],
     "src": [
      {
       "id": "R-ESC-SCA",
       "loc": "§ 3.1 et 3.2",
       "lu_le": "2026-10-17"
      },
      {
       "id": "R-ESC-AORTE",
       "loc": "§ 9.3.1.2 et 9.3.1.3",
       "lu_le": "2026-10-17"
      },
      {
       "id": "R-ESC-EP",
       "loc": "§ 4",
       "lu_le": "2026-10-17"
      },
      {
       "id": "R-ERC-SPEC",
       "loc": "Tension pneumothorax",
       "lu_le": "2026-10-17"
      }
     ]
    },
    {
     "t": "Il ausculte le cœur et recherche en particulier un souffle diastolique.",
     "pts": 1,
     "pourquoi": "Un souffle diastolique d’insuffisance aortique oriente aussi vers une dissection de l’aorte ascendante.",
     "ges": [
      "coeur-vaisseaux_5",
      "coeur-vaisseaux_9"
     ],
     "hyp": [
      "dissection-aortique"
     ],
     "src": [
      {
       "id": "R-ESC-SCA",
       "loc": "§ 3.1 et 3.2",
       "lu_le": "2026-10-17"
      },
      {
       "id": "R-ESC-AORTE",
       "loc": "§ 9.3.1.2 et 9.3.1.3",
       "lu_le": "2026-10-17"
      },
      {
       "id": "R-ESC-EP",
       "loc": "§ 4",
       "lu_le": "2026-10-17"
      },
      {
       "id": "R-ERC-SPEC",
       "loc": "Tension pneumothorax",
       "lu_le": "2026-10-17"
      }
     ]
    },
    {
     "t": "Il ausculte les poumons de façon comparative, regarde les veines jugulaires et la position de la trachée.",
     "pts": 1,